<?xml version="1.0" encoding="utf-8"?>
<!--XML file automatically generated by WorkVisual V6.0.31_Build3247.-->
<!--DO NOT EDIT-->
<DriveTech xsi:noNamespaceSchemaLocation="../../../System/Common/Schemes/NextGenDriveTech.xsd" xmlns:xsi="http://www.w3.org/2001/XMLSchema-instance">
  <Version Label="">
    <Info Version="KUKA V8.7" />
    <Schema Version="3" />
  </Version>
  <AxisConfig>
    <Axis ID="1" SupplyChannel="1" ConfigFile="Mada\NGAxis\A1.xml" />
    <Axis ID="2" SupplyChannel="1" ConfigFile="Mada\NGAxis\A2.xml" />
    <Axis ID="3" SupplyChannel="1" ConfigFile="Mada\NGAxis\A3.xml" />
    <Axis ID="4" SupplyChannel="1" ConfigFile="Mada\NGAxis\A5.xml" />
    <Axis ID="5" SupplyChannel="1" ConfigFile="Mada\NGAxis\A6.xml" />
  </AxisConfig>
  <SensorConfig />
  <SupplyConfig>
    <Supply Setup="AC" NominalSupplyVoltage="560" ConfigFile="Supply/KPP600-67L_380V_3200.xml" />
  </SupplyConfig>
  <FastMeasuring />
  <CommonConfig SdoPollIntervall="2" StopOnPhaseLoss="true" TickTockActivated="true" />
</DriveTech>